[
  {
    "slug": "attainment-on-the-tree-of-life-class-1",
    "title": "Attainment on the Tree of Life - Class 1",
    "catalogNumber": "",
    "grouping": "Attainment on the Tree of Life",
    "groupingSlug": "attainment-on-the-tree-of-life",
    "durationSeconds": 4795,
    "audioPath": "attainment-on-the-tree-of-life/attainment-on-the-tree-of-life-class-1.mp3"
  },
  {
    "slug": "attainment-on-the-tree-of-life-class-10",
    "title": "Attainment on the Tree of Life - Class 10",
    "catalogNumber": "",
    "grouping": "Attainment on the Tree of Life",
    "groupingSlug": "attainment-on-the-tree-of-life",
    "durationSeconds": 6900,
    "audioPath": "attainment-on-the-tree-of-life/attainment-on-the-tree-of-life-class-10.mp3"
  },
  {
    "slug": "attainment-on-the-tree-of-life-class-11",
    "title": "Attainment on the Tree of Life - Class 11",
    "catalogNumber": "",
    "grouping": "Attainment on the Tree of Life",
    "groupingSlug": "attainment-on-the-tree-of-life",
    "durationSeconds": 3064,
    "audioPath": "attainment-on-the-tree-of-life/attainment-on-the-tree-of-life-class-11.mp3"
  },
  {
    "slug": "attainment-on-the-tree-of-life-class-2",
    "title": "Attainment on the Tree of Life - Class 2",
    "catalogNumber": "",
    "grouping": "Attainment on the Tree of Life",
    "groupingSlug": "attainment-on-the-tree-of-life",
    "durationSeconds": 5429,
    "audioPath": "attainment-on-the-tree-of-life/attainment-on-the-tree-of-life-class-2.mp3"
  },
  {
    "slug": "attainment-on-the-tree-of-life-class-3",
    "title": "Attainment on the Tree of Life - Class 3",
    "catalogNumber": "",
    "grouping": "Attainment on the Tree of Life",
    "groupingSlug": "attainment-on-the-tree-of-life",
    "durationSeconds": 4174,
    "audioPath": "attainment-on-the-tree-of-life/attainment-on-the-tree-of-life-class-3.mp3"
  },
  {
    "slug": "attainment-on-the-tree-of-life-class-4",
    "title": "Attainment on the Tree of Life - Class 4",
    "catalogNumber": "",
    "grouping": "Attainment on the Tree of Life",
    "groupingSlug": "attainment-on-the-tree-of-life",
    "durationSeconds": 4737,
    "audioPath": "attainment-on-the-tree-of-life/attainment-on-the-tree-of-life-class-4.mp3"
  },
  {
    "slug": "attainment-on-the-tree-of-life-class-5",
    "title": "Attainment on the Tree of Life - Class 5",
    "catalogNumber": "",
    "grouping": "Attainment on the Tree of Life",
    "groupingSlug": "attainment-on-the-tree-of-life",
    "durationSeconds": 6518,
    "audioPath": "attainment-on-the-tree-of-life/attainment-on-the-tree-of-life-class-5.mp3"
  },
  {
    "slug": "attainment-on-the-tree-of-life-class-6",
    "title": "Attainment on the Tree of Life - Class 6",
    "catalogNumber": "",
    "grouping": "Attainment on the Tree of Life",
    "groupingSlug": "attainment-on-the-tree-of-life",
    "durationSeconds": 5194,
    "audioPath": "attainment-on-the-tree-of-life/attainment-on-the-tree-of-life-class-6.mp3"
  },
  {
    "slug": "attainment-on-the-tree-of-life-class-7",
    "title": "Attainment on the Tree of Life - Class 7",
    "catalogNumber": "",
    "grouping": "Attainment on the Tree of Life",
    "groupingSlug": "attainment-on-the-tree-of-life",
    "durationSeconds": 5704,
    "audioPath": "attainment-on-the-tree-of-life/attainment-on-the-tree-of-life-class-7.mp3"
  },
  {
    "slug": "attainment-on-the-tree-of-life-class-8",
    "title": "Attainment on the Tree of Life - Class 8",
    "catalogNumber": "",
    "grouping": "Attainment on the Tree of Life",
    "groupingSlug": "attainment-on-the-tree-of-life",
    "durationSeconds": 5966,
    "audioPath": "attainment-on-the-tree-of-life/attainment-on-the-tree-of-life-class-8.mp3"
  },
  {
    "slug": "attainment-on-the-tree-of-life-class-9",
    "title": "Attainment on the Tree of Life - Class 9",
    "catalogNumber": "",
    "grouping": "Attainment on the Tree of Life",
    "groupingSlug": "attainment-on-the-tree-of-life",
    "durationSeconds": 6347,
    "audioPath": "attainment-on-the-tree-of-life/attainment-on-the-tree-of-life-class-9.mp3"
  },
  {
    "slug": "1-how-tarot-perfects-the-intellect",
    "title": "1. How Tarot Perfects the Intellect",
    "catalogNumber": "",
    "grouping": "Preparing the Personality for Initiation",
    "groupingSlug": "preparing-the-personality-for-initiation",
    "durationSeconds": 2631,
    "audioPath": "preparing-the-personality-for-initiation/1-how-tarot-perfects-the-intellect.mp3"
  },
  {
    "slug": "2-tarot-for-strengthening-emotional-control",
    "title": "2. Tarot for Strengthening Emotional Control",
    "catalogNumber": "",
    "grouping": "Preparing the Personality for Initiation",
    "groupingSlug": "preparing-the-personality-for-initiation",
    "durationSeconds": 2292,
    "audioPath": "preparing-the-personality-for-initiation/2-tarot-for-strengthening-emotional-control.mp3"
  },
  {
    "slug": "3-balance-your-mind-and-emotions-through-tarot",
    "title": "3. Balance your Mind and Emotions through Tarot",
    "catalogNumber": "",
    "grouping": "Preparing the Personality for Initiation",
    "groupingSlug": "preparing-the-personality-for-initiation",
    "durationSeconds": 2392,
    "audioPath": "preparing-the-personality-for-initiation/3-balance-your-mind-and-emotions-through-tarot.mp3"
  },
  {
    "slug": "4-the-way-tarot-brings-spiritual-perception",
    "title": "4. The way Tarot brings Spiritual Perception",
    "catalogNumber": "",
    "grouping": "Preparing the Personality for Initiation",
    "groupingSlug": "preparing-the-personality-for-initiation",
    "durationSeconds": 3076,
    "audioPath": "preparing-the-personality-for-initiation/4-the-way-tarot-brings-spiritual-perception.mp3"
  },
  {
    "slug": "qabalistic-paths-to-the-inner-planes-class-1",
    "title": "Qabalistic Paths to the Inner Planes - Class 1",
    "catalogNumber": "",
    "grouping": "Qabalistic Paths to the Inner Planes",
    "groupingSlug": "qabalistic-paths-to-the-inner-planes",
    "durationSeconds": 5287,
    "audioPath": "qabalistic-paths-to-the-inner-planes/qabalistic-paths-to-the-inner-planes-class-1.mp3"
  },
  {
    "slug": "qabalistic-paths-to-the-inner-planes-class-2",
    "title": "Qabalistic Paths to the Inner Planes - Class 2",
    "catalogNumber": "",
    "grouping": "Qabalistic Paths to the Inner Planes",
    "groupingSlug": "qabalistic-paths-to-the-inner-planes",
    "durationSeconds": 6164,
    "audioPath": "qabalistic-paths-to-the-inner-planes/qabalistic-paths-to-the-inner-planes-class-2.mp3"
  },
  {
    "slug": "qabalistic-paths-to-the-inner-planes-class-3",
    "title": "Qabalistic Paths to the Inner Planes - Class 3",
    "catalogNumber": "",
    "grouping": "Qabalistic Paths to the Inner Planes",
    "groupingSlug": "qabalistic-paths-to-the-inner-planes",
    "durationSeconds": 5595,
    "audioPath": "qabalistic-paths-to-the-inner-planes/qabalistic-paths-to-the-inner-planes-class-3.mp3"
  },
  {
    "slug": "qabalistic-paths-to-the-inner-planes-class-4",
    "title": "Qabalistic Paths to the Inner Planes - Class 4",
    "catalogNumber": "",
    "grouping": "Qabalistic Paths to the Inner Planes",
    "groupingSlug": "qabalistic-paths-to-the-inner-planes",
    "durationSeconds": 6110,
    "audioPath": "qabalistic-paths-to-the-inner-planes/qabalistic-paths-to-the-inner-planes-class-4.mp3"
  },
  {
    "slug": "qabalistic-paths-to-the-inner-planes-class-5",
    "title": "Qabalistic Paths to the Inner Planes - Class 5",
    "catalogNumber": "",
    "grouping": "Qabalistic Paths to the Inner Planes",
    "groupingSlug": "qabalistic-paths-to-the-inner-planes",
    "durationSeconds": 4338,
    "audioPath": "qabalistic-paths-to-the-inner-planes/qabalistic-paths-to-the-inner-planes-class-5.mp3"
  },
  {
    "slug": "qabalistic-paths-to-the-inner-planes-class-6",
    "title": "Qabalistic Paths to the Inner Planes - Class 6",
    "catalogNumber": "",
    "grouping": "Qabalistic Paths to the Inner Planes",
    "groupingSlug": "qabalistic-paths-to-the-inner-planes",
    "durationSeconds": 4742,
    "audioPath": "qabalistic-paths-to-the-inner-planes/qabalistic-paths-to-the-inner-planes-class-6.mp3"
  },
  {
    "slug": "qabalistic-paths-to-the-inner-planes-class-7",
    "title": "Qabalistic Paths to the Inner Planes - Class 7",
    "catalogNumber": "",
    "grouping": "Qabalistic Paths to the Inner Planes",
    "groupingSlug": "qabalistic-paths-to-the-inner-planes",
    "durationSeconds": 3130,
    "audioPath": "qabalistic-paths-to-the-inner-planes/qabalistic-paths-to-the-inner-planes-class-7.mp3"
  },
  {
    "slug": "qabalistic-paths-to-the-inner-planes-class-8",
    "title": "Qabalistic Paths to the Inner Planes - Class 8",
    "catalogNumber": "",
    "grouping": "Qabalistic Paths to the Inner Planes",
    "groupingSlug": "qabalistic-paths-to-the-inner-planes",
    "durationSeconds": 5904,
    "audioPath": "qabalistic-paths-to-the-inner-planes/qabalistic-paths-to-the-inner-planes-class-8.mp3"
  },
  {
    "slug": "qabalistic-paths-to-the-inner-planes-class-9",
    "title": "Qabalistic Paths to the Inner Planes - Class 9",
    "catalogNumber": "",
    "grouping": "Qabalistic Paths to the Inner Planes",
    "groupingSlug": "qabalistic-paths-to-the-inner-planes",
    "durationSeconds": 5684,
    "audioPath": "qabalistic-paths-to-the-inner-planes/qabalistic-paths-to-the-inner-planes-class-9.mp3"
  },
  {
    "slug": "vol-1-track-01",
    "title": "Vol 1-Track 01",
    "catalogNumber": "",
    "grouping": "Qabalistic Power Of Words",
    "groupingSlug": "qabalistic-power-of-words",
    "durationSeconds": 1619,
    "audioPath": "qabalistic-power-of-words/vol-1-track-01.mp3"
  },
  {
    "slug": "vol-1-track-02",
    "title": "Vol 1-Track 02",
    "catalogNumber": "",
    "grouping": "Qabalistic Power Of Words",
    "groupingSlug": "qabalistic-power-of-words",
    "durationSeconds": 1451,
    "audioPath": "qabalistic-power-of-words/vol-1-track-02.mp3"
  },
  {
    "slug": "vol-2-track-01",